title,text,summary1,summary2,summary3
লতিফ সিদ্দিকী ছয় মাসের জামিন,ধর্মীয় অনুভূতিতে আঘাতের অভিযোগে মামলায় হাইকোর্ট জামিন পেয়েছেন সাবেক মন্ত্রী আবদুল লতিফ সিদ্দিকী বিচারপতি মো নিজামুল হক বিচারপতি মো ফরিদ আহমদ শিবলীর সমন্বয়ে ঘটিত হাইকোর্ট বেঞ্চ মঙ্গলবার আদেশ আদালতে লতিফ সিদ্দিকীর শুনানি আইনজীবী জ্যোতির্ময় বড়ুয়া রাষ্ট্রপক্ষে ডেপুটি অ্যাটর্নি জেনারেল শেখ এম মনিরুজ্জামান গত মে ধর্মীয় অনুভূতিতে আঘাতের অভিযোগে সাত মামলায় সাবেক মন্ত্রীকে ছয় মাসের অন্তর্বর্তী জামিন দিয়েছেন হাইকোর্ট এসব মামলার কার্যক্রম ছয় মাসের স্থগিত আদালত গত বছর সেপ্টেম্বরে যুক্তরাষ্ট্রের নিউইয়র্কে এক অনুষ্ঠানে হজ তাবলিগ জামাত বিরূপ মন্তব্য সমালোচনার মুখে পড়েন আবদুল লতিফ সিদ্দিকী ঘটনার আওয়ামী লীগের সভাপতিমণ্ডলীর সদস্য দল বহিষ্কৃত ঘটনায় ধর্মীয় অনুভূতিতে আঘাত কটূক্তির অভিযোগে বিরুদ্ধে রাজধানী ঢাকাসহ দেশের জেলায় কয়েকটি মামলা নির্ধারিত সময়ে আদালতে হাজির হওয়ায় প্রতিটি মামলায় বিরুদ্ধে গ্রেপ্তারি পরোয়ানা জারি আদালত গত বছরের নভেম্বর ধানমন্ডি থানায় আত্মসমর্পণ আদালত কারাগারে পাঠানোর নির্দেশ মঙ্গলবার লতিফ সিদ্দিকীর আবেদনের ওপর শুনানি বিচারপতি মো নিজামুল হক বিচারপতি মো ফরিদ আহমদ শিবলীর বেঞ্চ রুলসহ আদেশ দেয় এরমধ্যে চাঁপাইনবাবগঞ্জ লক্ষ্মীপুর ঢাকাল চট্টগ্রামের সাতটি মামলা রয়েছে অভিযোগে পাঁচটি মামলা থাকায় আওয়ামী লীগের বহিষ্কৃত নেতা লতিফ এখনই মুক্তি পাচ্ছেন আদালতে শুনানি ব্যারিস্টার জ্যোতির্ময় বড়ুয়া রাষ্ট্রপক্ষে ডেপুটি অ্যাটর্নি জেনারেল শেখ এম মনিরুজ্জামান কবির দশ মামলায় লতিফকে অন্তবর্তীকালীন জামিন দেওয়ার পাশাপাশি মামলাগুলোর কার্যক্রম ছয় মাসের স্থগিত আদালত এসব মামলা বাতিল চেয়ে রুলও জারি হয়েছে মামলার বাদী সরকারকে সপ্তাহের জবাব ঢাকার হাকিম আদালত জজ আদালত এসব মামলায় লতিফের জামিন নাকচ করেছিল আদেশের ডেপুটি অ্যাটর্নি জেনারেল মনিরুজ্জামান কবির মামলায় লতিফ সিদ্দিকী জামিন পেলেন পাঁচটি মামলা থাকায় আপাতত মুক্তি পাচ্ছেন,ধর্মীয় অনুভূতিতে আঘাতের অভিযোগে মামলায় হাইকোর্ট জামিন পেয়েছেন সাবেক মন্ত্রী আবদুল লতিফ সিদ্দিকী গত বছর সেপ্টেম্বরে যুক্তরাষ্ট্রের নিউইয়র্কে এক অনুষ্ঠানে হজ তাবলিগ জামাত বিরূপ মন্তব্য সমালোচনার মুখে পড়েন আবদুল লতিফ সিদ্দিকী নির্ধারিত সময়ে আদালতে হাজির হওয়ায় প্রতিটি মামলায় বিরুদ্ধে গ্রেপ্তারি পরোয়ানা জারি আদালত দশ মামলায় লতিফকে অন্তবর্তীকালীন জামিন দেওয়ার পাশাপাশি মামলাগুলোর কার্যক্রম ছয় মাসের স্থগিত আদালত এসব মামলা বাতিল চেয়ে রুলও জারি হয়েছে মামলার বাদী সরকারকে সপ্তাহের জবাব আদেশের ডেপুটি অ্যাটর্নি জেনারেল মনিরুজ্জামান কবির মামলায় লতিফ সিদ্দিকী জামিন পেলেন পাঁচটি মামলা থাকায় আপাতত মুক্তি পাচ্ছেন,ধর্মীয় অনুভূতিতে আঘাতের অভিযোগে মামলায় হাইকোর্ট জামিন পেয়েছেন সাবেক মন্ত্রী আবদুল লতিফ সিদ্দিকী বিচারপতি মো নিজামুল হক বিচারপতি মো ফরিদ আহমদ শিবলীর সমন্বয়ে ঘটিত হাইকোর্ট বেঞ্চ মঙ্গলবার আদেশ গত মে ধর্মীয় অনুভূতিতে আঘাতের অভিযোগে সাত মামলায় সাবেক মন্ত্রীকে ছয় মাসের অন্তর্বর্তী জামিন দিয়েছেন হাইকোর্ট ঘটনায় ধর্মীয় অনুভূতিতে আঘাত কটূক্তির অভিযোগে বিরুদ্ধে রাজধানী ঢাকাসহ দেশের জেলায় কয়েকটি মামলা গত বছরের নভেম্বর ধানমন্ডি থানায় আত্মসমর্পণ আদালত কারাগারে পাঠানোর নির্দেশ মঙ্গলবার লতিফ সিদ্দিকীর আবেদনের ওপর শুনানি বিচারপতি মো নিজামুল হক বিচারপতি মো ফরিদ আহমদ শিবলীর বেঞ্চ রুলসহ আদেশ দেয় আদেশের ডেপুটি অ্যাটর্নি জেনারেল মনিরুজ্জামান কবির মামলায় লতিফ সিদ্দিকী জামিন পেলেন পাঁচটি মামলা থাকায় আপাতত মুক্তি পাচ্ছেন,ধর্মীয় অনুভূতিতে আঘাতের অভিযোগে মামলায় হাইকোর্ট জামিন পেয়েছেন সাবেক মন্ত্রী আবদুল লতিফ সিদ্দিকী বিচারপতি মো নিজামুল হক বিচারপতি মো ফরিদ আহমদ শিবলীর সমন্বয়ে ঘটিত হাইকোর্ট বেঞ্চ মঙ্গলবার আদেশ গত মে ধর্মীয় অনুভূতিতে আঘাতের অভিযোগে সাত মামলায় সাবেক মন্ত্রীকে ছয় মাসের অন্তর্বর্তী জামিন দিয়েছেন হাইকোর্ট গত বছর সেপ্টেম্বরে যুক্তরাষ্ট্রের নিউইয়র্কে এক অনুষ্ঠানে হজ তাবলিগ জামাত বিরূপ মন্তব্য সমালোচনার মুখে পড়েন আবদুল লতিফ সিদ্দিকী গত বছরের নভেম্বর ধানমন্ডি থানায় আত্মসমর্পণ আদালত কারাগারে পাঠানোর নির্দেশ এসব মামলা বাতিল চেয়ে রুলও জারি হয়েছে মামলার বাদী সরকারকে সপ্তাহের জবাব আদেশের ডেপুটি অ্যাটর্নি জেনারেল মনিরুজ্জামান কবির মামলায় লতিফ সিদ্দিকী জামিন পেলেন পাঁচটি মামলা থাকায় আপাতত মুক্তি পাচ্ছেন
বুয়েট বন্ধ ত্যাগের নির্দেশ,বাংলাদেশ প্রকৌশল বিশ্ববিদ্যালয় বুয়েট বৃহস্পতিবার অনির্দিষ্টকালের বন্ধ ঘোষণা হয়েছে বিকেল পাঁচটার আবাসিক অবস্থানরত ছাত্রছাত্রীকে ছাড়ার নির্দেশ হয়েছে আড়াইটার আদেশ সংবলিত বিজ্ঞপ্তি হলের নোটিশ বোর্ডে সেঁটে বুয়েটের রেজিস্ট্রার অধ্যাপক এম মাসুদ স্বাক্ষরিত বিজ্ঞপ্তির ভাষ্য চলতি টার্মের পূর্ব ঘোষিত টার্ম ফাইনাল পরীক্ষা পেছানোর দাবিতে জুন একদল ছাত্রছাত্রীর উপাচার্য রেজিস্ট্রার ছাত্রকল্যাণ পরিচালককে উপাচার্য কার্যালয়ে জিম্মি জুন শিক্ষকদের আবাসিক এলাকা অবরুদ্ধ রাতে একাডেমিক ভবন ভাঙচুর অগ্নিসংযোগ পরিপ্রেক্ষিতে বিশ্ববিদ্যালয়ের সার্বিক আইনশৃঙ্খলা পরিস্থিতির চরম অবনতি ঘটছে শিক্ষার পরিবেশ ভীষণভাবে বিঘ্নিত অবস্থায় বিশ্ববিদ্যালয়ের সার্বিক শৃঙ্খলা বজায় ছাত্রছাত্রী শিক্ষক কর্মকর্তাকর্মচারীদের জানমালের নিরাপত্তা বিধানের স্বার্থে শিক্ষার সুষ্ঠু পরিবেশ ফিরিয়ে আনার লক্ষ্যে বিশ্ববিদ্যালয়ের শিক্ষা কার্যক্রম বিকেল অনির্দিষ্টকালের বন্ধ ঘোষণা পরীক্ষা পেছানোর দাবিতে বিশৃঙ্খলার প্রেক্ষাপটে বাংলাদেশ প্রকৌশল বিশ্ববিদ্যালয়বুয়েট অনির্দিষ্টকালের বন্ধ ঘোষণা কর্তৃপক্ষ বৃহস্পতিবার বিকাল টার ছাত্রছাত্রীদের ছাড়ার নির্দেশ হয়েছে বুয়েটের ছাত্রকল্যাণ পরিচালক অধ্যাপক দেলোয়ার হোসেন জানান রোজায় ছাত্রছাত্রীরা পরীক্ষা চাচ্ছিল কারণে বিশ্ববিদ্যালয়ে ভাংচুর অস্থিতিশীলত পরিস্থিতির সৃষ্টি হওয়ায় কর্তৃপক্ষ সিদ্ধান্ত নিয়েছে,বুয়েটের রেজিস্ট্রার অধ্যাপক এম মাসুদ স্বাক্ষরিত বিজ্ঞপ্তির ভাষ্য চলতি টার্মের পূর্ব ঘোষিত টার্ম ফাইনাল পরীক্ষা পেছানোর দাবিতে জুন একদল ছাত্রছাত্রীর উপাচার্য রেজিস্ট্রার ছাত্রকল্যাণ পরিচালককে উপাচার্য কার্যালয়ে জিম্মি জুন শিক্ষকদের আবাসিক এলাকা অবরুদ্ধ রাতে একাডেমিক ভবন ভাঙচুর অগ্নিসংযোগ পরিপ্রেক্ষিতে বিশ্ববিদ্যালয়ের সার্বিক আইনশৃঙ্খলা পরিস্থিতির চরম অবনতি ঘটছে শিক্ষার পরিবেশ ভীষণভাবে বিঘ্নিত অবস্থায় বিশ্ববিদ্যালয়ের সার্বিক শৃঙ্খলা বজায় ছাত্রছাত্রী শিক্ষক কর্মকর্তাকর্মচারীদের জানমালের নিরাপত্তা বিধানের স্বার্থে শিক্ষার সুষ্ঠু পরিবেশ ফিরিয়ে আনার লক্ষ্যে বিশ্ববিদ্যালয়ের শিক্ষা কার্যক্রম বিকেল অনির্দিষ্টকালের বন্ধ ঘোষণা বৃহস্পতিবার বিকাল টার ছাত্রছাত্রীদের ছাড়ার নির্দেশ হয়েছে বুয়েটের ছাত্রকল্যাণ পরিচালক অধ্যাপক দেলোয়ার হোসেন জানান,বাংলাদেশ প্রকৌশল বিশ্ববিদ্যালয় বুয়েট বৃহস্পতিবার অনির্দিষ্টকালের বন্ধ ঘোষণা হয়েছে বুয়েটের রেজিস্ট্রার অধ্যাপক এম মাসুদ স্বাক্ষরিত বিজ্ঞপ্তির ভাষ্য চলতি টার্মের পূর্ব ঘোষিত টার্ম ফাইনাল পরীক্ষা পেছানোর দাবিতে জুন একদল ছাত্রছাত্রীর উপাচার্য রেজিস্ট্রার ছাত্রকল্যাণ পরিচালককে উপাচার্য কার্যালয়ে জিম্মি জুন শিক্ষকদের আবাসিক এলাকা অবরুদ্ধ রাতে একাডেমিক ভবন ভাঙচুর অগ্নিসংযোগ পরিপ্রেক্ষিতে বিশ্ববিদ্যালয়ের সার্বিক আইনশৃঙ্খলা পরিস্থিতির চরম অবনতি ঘটছে শিক্ষার পরিবেশ ভীষণভাবে বিঘ্নিত বৃহস্পতিবার বিকাল টার ছাত্রছাত্রীদের ছাড়ার নির্দেশ হয়েছে বুয়েটের ছাত্রকল্যাণ পরিচালক অধ্যাপক দেলোয়ার হোসেন জানান,বাংলাদেশ প্রকৌশল বিশ্ববিদ্যালয় বুয়েট বৃহস্পতিবার অনির্দিষ্টকালের বন্ধ ঘোষণা হয়েছে বুয়েটের রেজিস্ট্রার অধ্যাপক এম মাসুদ স্বাক্ষরিত বিজ্ঞপ্তির ভাষ্য চলতি টার্মের পূর্ব ঘোষিত টার্ম ফাইনাল পরীক্ষা পেছানোর দাবিতে জুন একদল ছাত্রছাত্রীর উপাচার্য রেজিস্ট্রার ছাত্রকল্যাণ পরিচালককে উপাচার্য কার্যালয়ে জিম্মি জুন শিক্ষকদের আবাসিক এলাকা অবরুদ্ধ রাতে একাডেমিক ভবন ভাঙচুর অগ্নিসংযোগ পরিপ্রেক্ষিতে বিশ্ববিদ্যালয়ের সার্বিক আইনশৃঙ্খলা পরিস্থিতির চরম অবনতি ঘটছে শিক্ষার পরিবেশ ভীষণভাবে বিঘ্নিত বৃহস্পতিবার বিকাল টার ছাত্রছাত্রীদের ছাড়ার নির্দেশ হয়েছে বুয়েটের ছাত্রকল্যাণ পরিচালক অধ্যাপক দেলোয়ার হোসেন জানান
সমুদ্র বন্দরে নম্বর সতর্কতা ঝড়ের আশঙ্কা,সমুদ্রবন্দরগুলোকে নম্বর সতর্কতা নদীবন্দরগুলোকে নম্বর সতর্কতা দিয়ে আবহাওয়া অধিদফতর ‍জানিয়েছে দেশের জেলায় কিলোমিটার বেগে ঝড়ের আশঙ্কা ভারতের ঊড়িষ্যা তৎসংলগ্ন এলাকায় রোববার জুন অবস্থানরত স্থলনিম্নচাপটি বর্তমানে এলাকায় সুষ্পষ্ট লঘুচাপে অবস্থান নেওয়ায় সোমবার জুন রাতে আশঙ্কার কথা হয়েছে আবহাওয়া অধিদফতরের পক্ষ জারি সংক্রান্ত সতর্কবার্তায় লঘুচাপের প্রভাবে বঙ্গোপসাগর এলাকায় বায়ুচাপের তারতম্যের আধিক্য বিরাজ বঙ্গোপসাগর বাংলাদেশের উপকূলীয় এলাকা সমুদ্র বন্দরসমূহের দিয়ে ঝড়ো হাওয়া বয়ে চট্টগ্রাম কক্সবাজার মংলা পায়রা সমুদ্রবন্দরকে নম্বর স্থানীয় সতর্কতা সংকেত দেখিয়ে হয়েছে সেইসঙ্গে দেশের নদীবন্দরগুলোকেও নম্বর সতর্কতা সংকেত দেখিয়ে হয়েছে সতর্কবার্তায় সঙ্গোপসাগরে অবস্থানরত মাছ ধরার নৌকা ট্রলারগুলোকে পরবর্তী নির্দেশ উপকূলের কাছাকাছি সাধবানে চলাচল হয়েছে আবহাওয়া অধিদফতর জানায় রাতে যশোর সাতক্ষীরা খুলনা বরিশাল পটুয়াখালী নোয়াখালী কুমিল্লা চট্টগ্রাম কক্সবাজার অঞ্চলসমূহের ওপর দিয়ে কিলোমিটার বেগে ঝড়ো হাওয়াসহ বৃষ্টিবজ্রবৃষ্টি মঙ্গলবার জুন সকাল সতর্কতা মেনে চলতে হয়েছে,ভারতের ঊড়িষ্যা তৎসংলগ্ন এলাকায় রোববার জুন অবস্থানরত স্থলনিম্নচাপটি বর্তমানে এলাকায় সুষ্পষ্ট লঘুচাপে অবস্থান নেওয়ায় সোমবার জুন রাতে আশঙ্কার কথা হয়েছে সেইসঙ্গে দেশের নদীবন্দরগুলোকেও নম্বর সতর্কতা সংকেত দেখিয়ে হয়েছে,সমুদ্রবন্দরগুলোকে নম্বর সতর্কতা নদীবন্দরগুলোকে নম্বর সতর্কতা দিয়ে আবহাওয়া অধিদফতর ‍জানিয়েছে দেশের জেলায় কিলোমিটার বেগে ঝড়ের আশঙ্কা ভারতের ঊড়িষ্যা তৎসংলগ্ন এলাকায় রোববার জুন অবস্থানরত স্থলনিম্নচাপটি বর্তমানে এলাকায় সুষ্পষ্ট লঘুচাপে অবস্থান নেওয়ায় সোমবার জুন রাতে আশঙ্কার কথা হয়েছে,ভারতের ঊড়িষ্যা তৎসংলগ্ন এলাকায় রোববার জুন অবস্থানরত স্থলনিম্নচাপটি বর্তমানে এলাকায় সুষ্পষ্ট লঘুচাপে অবস্থান নেওয়ায় সোমবার জুন রাতে আশঙ্কার কথা হয়েছে সেইসঙ্গে দেশের নদীবন্দরগুলোকেও নম্বর সতর্কতা সংকেত দেখিয়ে হয়েছে
